title,hits.total,info.comments_count,images.length,link,body
親子餐廳-親子館-新開幕||班尼弟親子食遊館 私人包廂 辦生日趴首選 多種主題房 抓週 收涎 生日會 0~12都適合,10625,1,183,http://sardpnna.pixnet.net/blog/post/202398577, ;班尼弟親子食遊館新北市中和區中山路2段305號1樓02-22442999週二-週日:11:00 到 21:00https://www.facebook.com/benedict.restaurant消費方式: 【公共用餐區】: 大人(12歲以上) 基本消費490元 兒童( 2 歲以上) 基本消費350元＋清潔費100元 幼兒(1~2歲) 清潔費 200元，1歲以下免收 ※2歲以下贈送專屬幼兒的果汁或粥品 ※用餐時間: 2小時，另收餐點費用10%的服務費 班尼弟親子食遊館，位於中和家樂福旁邊,接近景平路與中山路二段交叉口。 停車:可停放於宸上飯店旁邊的平面收費停車場，;;;;;;; 或停至家樂福的地下停車場。  公車:【307】、【262】、【5】至中和南山威力廣場 【專屬包廂區】 包廂共有5間，採預約優先制 基本消費為3000元/間，另收包廂費500元 清潔費每位小孩100元,每次使用兩個小時例如:五大五小 餐飲抵消費$3000+包廂費$500+人頭清潔費$500=4000 平均一人$400辦趴需要的生日旗子 抓週需要的道具 都不需要額外費用唷!(須提前預約)每間包廂適合人數6~7人 ※用餐時間: 2小時，另收餐點費用10%的服務費 ※預約時段: 第一場11：00- 13：00 第二場13：30- 15：30  第三場16：00- 18：00 第四場18：30- 20：30  （每時段間皆會清潔消毒）全新的粉絲頁,專攻美食X旅遊,親子X育兒 喜歡飛炫葡萄媽的朋友們&darr;&darr;&darr;歡迎按讚加入《飛炫葡萄媽||美食X旅遊blog》，一起去吃香喝辣的!飛炫葡萄媽 ll美食x旅遊blog一起吃喝去;2015新開幕X親子餐廳||班尼弟親子食遊館 私人包廂 辦生日趴首選 多種主題房 抓週 收涎 生日會 0~12都適合;;這是葡萄媽今天發現的新大陸由於身邊的媽媽不停地在詢問這麼棒的包廂親子館在哪所以就算是前面壓著多篇食記,遊記,也想讓班尼弟插隊一下!!畢竟親子餐廳能有"包廂"這真的太威了我還想問問看老闆之前是不是夜店咖?有小孩之後把包廂那一套搬來給小朋友了不然房間玩一玩,再出來公共區域玩一玩這不是夜店才有的模式嗎 哈哈哈!!!總之葡萄媽真的很買這招!!!所以才迫不及待想要跟媽媽們分享如果最近有要辦生日趴,收涎趴,抓周趴葡萄媽大大的推薦在中和的班尼弟親子食遊館這裡應該是葡萄媽看過的親子館,辦趴最適合的場所了吧如果嫌遠別擔心,旁邊就有家樂福,停車超方便!!結束後再到家樂福買一些家裡用品還可以抵停車費真的很划算葡萄只要出來玩都開心這也是,再搬去澎湖前趕緊跟朋友聚聚餐聊聊天的好地方要不是今天太突然起約,真的都會把阿寶,妮妮,小發糕,葡萄的好朋友給約齊呢!; 在中和威力廣場旁邊的大樓往大樓裡頭走,感覺有點點隱密這一間是2015八月一號新開幕的親子餐廳門口都是花圈祝賀,葡萄媽最喜歡去新開幕的親子館搶頭香了 櫃檯區,後頭有很多小禮物都是消費集點兌換的唷^^~很會收買小孩的心  ;在櫃台旁還有這手工餅乾,原本葡萄跟宥宥再拿這餅乾媽媽已經打算掏錢買的同時班尼弟的店長姊姊已經送給小朋友一人片餅乾了從一進門就讓這些貼心的小舉動給收買了!! ;班尼弟親子食遊館 ,店裡偏向長條的設計前段是公共區域遊戲是中間是公共區域的餐廳尾端有五間主題式包廂文中慢慢分享,請看下去~~~哈~葡萄媽太懂中午時段都是大爆滿的狀況這在櫃檯前的仿木椅,就是讓媽媽可以輕鬆排隊等候的店裡有粉絲專業常常都有新消息,可以加入班尼弟的粉絲團,注意優惠動向消費模式葡萄媽上面就有仔細分享一番有空可以研究研究; 從櫃檯慢慢走進來左邊是玩具販售都是店內有的玩具跟餐具BTOYS,;;   ;;;  our generation的娃娃;;; 還有強調無毒的Green Toys&amp;Eats 的餐具還有美國Play Circle的扮家家酒遊戲 總之想要在這區走出去還真不容易只是兩個娃兒的金主都不在想要買東西,可能有點困難度哈哈哈ㄏ~~宥宥爸爸你看看,宥宥想買娃娃啊!^^~好在班尼弟可以分心的地方太多我們不讓玩具影響太久趕緊繼續往前走!!公共區域的遊戲空間也好玩;店內有分齡的空間覺得很棒1~4歲的遊戲區積木,球池,溜滑梯; 積木怎麼玩?大小孩就會來跳跳格了!掛在牆壁的敲敲琴轉轉輪,這些看起來平凡的手撥遊戲都是七八個月到一歲多的小孩都很喜歡的遊戲在這裡好像站著就能玩很久了!!;; ;這裡的溜滑梯都很小很小就算是小小孩,媽媽都不用擔心有危險的那種^^;;看過很多親子館,都將年齡限定到0~6歲之間在班尼弟,把這種年齡給拉長了一點這區4~12歲裏頭有車車遊戲區也有氣槍射球也有球球往身上到的遊戲設計爬上,還有感統設計的概念在裡頭裡頭有一整圈的車道雖然不大,也夠小孩們在裡頭玩著跑跑卡丁車了哈哈``;;葡萄你想開車去哪裡呢???; ;不讓遊戲車浪費太多時間趕緊叫葡萄爬往二樓,更好玩的在這裡啊!!!;宥宥跟葡萄像是挑戰自己的手腳跟平衡感闖過這繩索橋媽媽們也不用擔心,其實底下是完全密封住的,根本不會跌倒阿哈哈~~~0危險性!! 裡頭也有設計一些感統的遊戲在裡頭爬上爬下,越過障礙物刺激前庭,刺激觸覺班尼弟這一區的設計很有在騎士堡~美人魚的家 (京華堡) 的感覺也是噴球,撿球,丟球,大一點的小孩可能還可以玩對戰之類的~~;其實這兩隻噴槍之間也是擋著遮蔽物互相是打不倒對方的,但是光是玩的過程中已經很過癮了!;葡萄很認真地裝著球噴球這裡有個連媽媽都陪玩得很開心就是按下開關,開啟這橘子大桶吸球器將地板上的球往兩個洞裡丟都會有不一樣的驚喜唷!;在右邊的洞口丟著彩色球彩色球會吸上頭上的大網子內集了滿滿的色球後,刺激的來瞜!!;;;;;按下開關,球球就往身上到瞜!幾乎小朋友都會尖叫阿;別擔心這球真的很軟很軟完全是不痛不癢的但是這種刺激感還是讓小朋友很期待又害怕的;  ;  ;在射球的氣槍旁都有幾個網籃裝的就是這些彩色球這球也是從吸球機器給送上來的將球丟入左邊的吸球機器再將籃子對上噴球機器旁的球洞你的球不費吹灰之力,就已經是囊中球了!!ㄏ ;抱抱~; ;;;以上這些都是公共區域適合一歲以上的小孩那會問問,一歲以下的小北比玩甚麼;;???班尼弟也有用心規劃出很棒的小小孩專區裡面放著式靜態的遊戲有書,布書,小小抓握的球,車遊戲都有 ;可愛瓢蟲陪你拍照讀書^^;;    ; ;由於預訂的包廂還在消毒清潔我們先在公共區域的餐廳,點餐休息 桌椅的設計也相當的貼心這椅子翻開就是置物櫃把自己的包包坐在屁股底下在安全不過了^^哈;在班尼弟耗到最後一刻才拍到這淨空的場面不然中午時刻也是十幾個爸媽在這區幫小孩慶生過開心的生日趴;;;; 最讓我覺得貼心度破表,就是上頭的電視了遊戲區都裝攝影機,爸媽都可以在這裡看著小孩的動態剛好可以監控翅膀很硬的大小孩哈哈!! ;而這樣的畫面,不只是公共區域有每個包廂也都有獨立的電視,爸媽們在包廂內就可以關心外頭世界的一舉一動班尼弟有五間包廂分別是海洋之星,甜蜜派對.搖滾火箭.叢林冒險.,神鬼奇航每一間提供給客人包場的時間都為兩個小時再交給下一組客人時,都相當高規格使用二氧化氯霧化氣全程消毒殺菌的消毒;;門上都有觀視窗,在小朋友的身高處也有這窗口,葡萄跟宥宥遊走幾間房就是在盤算想要進去哪一間葡萄還會跑來媽媽的身邊我很想要進去裡面玩ㄟ! 拜託~~(佩佩豬的口氣)~; 雖然每一間包廂都有低消,但是門檻很低【專屬包廂區】 包廂共有5間，採預約優先制 基本消費為3000元/間，另收包廂費500元 清潔費每位小孩100元,每次使用兩個小時比起以往訂過的辦趴的親子館這門檻低很多很多了....而且相當隱密....畢竟葡萄身邊的媽媽們太多,幾乎都有想要辦趴的需求,雖然這幾間房,都還沒消毒的情況下拜託店長給我們拍照一下!海洋之星如同此名,進入這包廂好像走入海邊般牆上的壁貼就是沙灘 在這裡玩的是不會用髒手的動力沙玩沙的玩具還真不少房間裡頭還有一區小海邊旁邊有魚桿有網子,小朋友就盡情的撈魚吧^^ ;;;;; ;; 訂包廂還有個好就是每間包廂都有廁所唷!!戒尿片中的小人,不用排隊等廁所包廂內的親子廁所解決媽媽的困擾搖滾火箭;讓我們一起奔去火箭吧^^這一區是氣墊床區小孩可以在這裡玩跳跳一個房間可以容納5~7個大,小人都沒問題; ;;;;獨立廁所叢林冒險;葡萄媽覺得這一間最刺激果然是冒險ㄟ牆壁上有一整片的攀岩牆如果覺得小孩根本不會攀岩,一點都不好玩就大錯特錯了!;竟然有提供給小朋友的攀岩器具ㄟ掛在身上由爸媽拉著繩索助小孩一臂之力好想來玩唷,誰要在這裡辦趴?邀請葡萄媽吧^^;;;;; ;可愛的大樹,也是溜滑梯唷! 樹洞裡頭也好多小動物阿^^小小孩也能用的盪鞦韆下次應該帶橘子來這裡辦個周歲趴的哈神鬼奇航完全是海盜的世界唷!!球池就是你的大海想要更過癮這裡還有道具讓你可以演的更像海盜這叢林冒險跟神鬼奇航原本是兩間小包廂但也能互通成為大包廂唷!!葡萄媽今天用餐時,這包廂就舒服地坐進超過二十人呢!!應該很多人馬上想問這包廂多少錢啊!!葡萄媽替朋友問了這兩間打通基本消費為6000元/間，另收包廂費1000元 清潔費每位小孩100元,每次使用兩個小時例如:10大10小 餐飲抵消費$6000+包廂費$1000+人頭清潔費$1000=8000 平均一人$400這樣認真算起來,在班尼弟辦趴的門檻真的低很多很多,價格上跟空間上都覺得很實惠這時候想問問看那個誰!!你要不要來這裡辦趴?不可以動的半圓沙發再搭配可移動的小圓椅,機動性真的很強ㄟ!兩間廁所^^不用擔心人多廁所問題` ; ;;在班尼弟每間包廂看起來都很好玩為了葡萄,小女生愛娃娃這次選了女孩會超級瘋狂的甜蜜派對這女孩肯定尖叫的房間~就像走入糖果屋的地方; 桌上已經擺好一些美國Play circle的扮家家酒還沒上菜,這裡已經開始擺上一桌了our generation的娃娃上次看到這娃娃是在三創生活園區葡萄就很喜歡了,這個包廂更是讓你一次玩很多...;;  ;;;  ;;;;;  ;裡頭還有葡萄喜歡的巧虎玩偶;      ;;;; ;;每間包廂都有獨立的廁所更貼心的是這洗手台媽媽終於不用抱著洗手,更方便; ;;甜蜜派對的可折抵消費的包廂費用是$3000唷!就算點不到金額也是要負擔三千的費用媽媽只好認真的想看看要點些甚麼兒童餐 $350; ;;在班尼弟消費用套餐比較划算除了主餐還包含湯品,附餐麵包,飲料 ;日式炸豬排丼飯 附味增湯 $550(套餐價)一開始還在想這樣的豬排飯是不是價位太高了只是認真看看,班尼弟的豬排飯,已經是葡萄媽近期來看過比手掌還大的豬排阿^^而且每片豬排都相當有厚度,真的相當好吃!!很推!!日式味增湯;;日式豬肉鮮菇燉飯 小朋友的餐具使用的都是相當環保的Green Toys&amp;Eats 的餐具主餐的份量相當大份唷!配菜還有花椰菜,馬鈴薯泥,蘋果除了搭配主廚湯還有飲料可以說是相當豐富的一餐阿附餐湯品番茄牛肉湯喝出來是用新鮮番茄去熬煮的湯頭,多了點點番茄的酸味好喝^^~番茄義大利蝴蝶麵小朋友的配菜是一樣的唷蝴蝶麵看起來相當討喜裹著滿滿的茄汁肉醬很容易讓人一口接一口只是煮過的醬汁還是帶有點點番茄酸度葡萄並沒有吃太多!!海鮮丸子牛奶湯裡頭配上的是少見是去殼的蛤蠣搭配一些海鮮丸湯頭如同巧達般的濃郁;上面三個套餐都有附上一顆核桃起司麵包在點餐時小寶貝的七嘴八舌的選了一些他們會喜歡的炸物煉乳薯條 $100以價格來說,分量相當多酥脆的薯條搭配煉乳真的很好吃阿; 麥克小雞塊 $120;烤檸檬雞翅 $180帶點焦脆的雞翅真的是大人的愛阿^^好吃好吃很快KO~;;;; 煉乳銀絲卷 $80第一次看過親子館有這菜但炸銀絲卷一直都是葡萄媽的最愛ˋ炸過的銀絲捲,剝著裡頭一絲絲的麵包真好吃~起司酥條$180起司在熱的時候會融化這點心要趁熱吃才好吃奇異果冰沙配合要滿低消,桌子上可是擠著滿滿^^兩個小時慢慢用餐;;;;;;;;;;; ;;上頭有杯麵的摩卡冰咖啡 只有在這親子餐廳才可以享受邊玩邊吃的樂趣吧^^媽媽在旁邊看著,不用太費力也能輕鬆聊天吃飯^^真的愛上包廂了^^;;  水果優格幫葡萄點的飲料看了白白不敢喝,從頭到尾都是媽媽喝掉,好喝阿^^裡頭還有很多水果在浮在上面唷!夏威夷水果鬆餅 $280這裡的鬆餅根外頭的格子鬆餅不同也不像pancake咬起來屬於鬆軟型層層的堆疊,小朋友無法一手一片搭配在旁邊的還有鮮奶油跟冰淇淋水果丁好夏日清爽的鬆餅阿^^沒想到葡萄是大口大口地挖著鮮奶油,妞兒,你為什麼不吃鬆餅吃奶油啊?;;;  ;包廂裡頭還有服務鈴想要其他的服務或是收盤整理桌面都可以透過按鈴請服務員來唷^^; 吃到後面真的撐了但是女人的甜點胃可是空空葡萄的巧克力冰淇淋宥宥的三片手工餅乾葡萄媽的大理石蛋糕這起司不是很硬的起司,帶點檸檬酸的起司蛋糕吃起來完全不會有負擔,一口口吃,不知不覺也吃完一整塊最後葡萄宥宥玩瘋了兩個媽媽的戰鬥力不佳全部打包^^回家孝敬鐵人爸 ;突然很想說這個點班尼弟的地板用的都是編織地毯走起來很舒服,感覺都可以赤腳在整個親子館走動一問才知道他們每天下班都請清潔公司天天洗地板才知道他們對衛生的品質要求這麼高^^怪不得小孩清潔費一定要付一點的啦!!; ;;哺乳室 換尿片區在親子館後方,有這麼貼心的一區提供空間給需要哺乳的媽媽換尿布的空間都比百貨公司還大多了!;;;為了各種沒有尿布的理由在尿布檯旁還有提供免費的尿布讓媽咪使用相當貼心!;; ; ;今天來班尼弟,這個親子包廂真的是大開眼界但私人的空間,聊起天,用起餐,真得更舒服買單後可以拿上集點卡累積一下都可以換櫃台後的玩具唷! 葡萄跟宥宥今天都換到了小飛機相當開心唷^^  ;跟店長聊天後才知道班尼弟的老闆在板橋有兩間托嬰中心和兩間幼兒園在經營才會對於遊戲,餐點,跟消毒都有這麼高規格的要求也是有這麼刁鑽的要求,才讓媽咪帶小孩玩得更安心^^很喜歡這種私人包廂的感覺希望很快有媽咪來這裡包場辦趴,再邀請小葡萄跟葡萄媽同遊阿^^這兩個吵著一起玩,又吵著要回家,離開後,還會這樣牽著緊緊的^^這兩個三歲娃,越來越難理解阿~~ ;;;  ;親子活動相關文台北捷運周邊x 親子餐廳X親子館懶人包||cp值最高 最好玩推薦 (置頂 2015 8月 更新);捷運忠孝新生站X三創生活圈||"Cafe Ballet 芭蕾咖啡親子餐廳(三創店)"早午餐菜單、環境分享在看皮克斯暑期總動員特展;捷運民權西路站||室內親子空間"幼佑城堡 Yoyo's Kid Castle"一個會玩到不想離開 會很想再來的親子館;捷運港墘站||菠啾花園Potager Garden陽光村一號店 日本野菜甜點名店。親子花園陽光小廚房。外拍;捷運市政府站||統一阪急百貨 chop chop 親子友善餐廳 一間可以留住孩子也可以留住爸爸的胃 決明子沙坑 迪士尼軌道 廚房遊戲;捷運文德站||內湖CHUCK LAND恰克園親子餐廳 家庭日 溜小孩吃好料;捷運士林站||在家也能輕鬆辦生日"麥當勞童樂生日趴" 葡萄三歲生日最後一趴 ;初體驗x小小麥體驗營||麥當勞"小小接待員" 職位難求 認真上班 親子活動 四種職務 六站親身實作體驗 葡萄的第一份工作;捷運蘆洲站X米妮生日派對||在"奧莉維亞親子餐廳"提前替四月壽星慶生,小資派對省省花,;捷運市政府站X親子餐廳||2015最熱門親子餐廳 貝兒絲BEAR'S WORLD 跑遍六大國 應有盡有的玩樂體驗;捷運信義安和站x英倫風||大樹站Mr Tree Station學齡前親子餐廳 火車球池 花園水池 大笨鐘沙池;台北兒童新樂園|| 100公分以下小孩眼裡的"兒童新樂園" "如果兒童劇團"天天有戲看 (細說交通接駁) ;新北市x三芝x動物景觀餐廳||Oia伊亞藝術咖啡館 草尼馬就在你身邊 續攤淺水灣踏浪 ;捷運南港展覽館x親子餐廳吃到飽||寒舍樂廚 好吃的甜點在這裡 親子城堡好威 帶小孩也能安心吃;台北x外雙溪X動物景觀餐廳||2014 兔子餐廳 TWO HOUSE (至善店) 看兔子餵山羊 讓人開心的親子餐廳;捷運劍南站x親子餐廳||Moooon Spring Cafe &amp; Play決明子沙坑,B.toy玩具好好玩;親子餐廳x蘆洲X新開幕||慶祝阿寶兩歲生日 朵娜好食 生日趴好HIGH! ;捷運東門站X邀約|| 小而巧 CP值很高 值得再訪的 樂福 LOVE 親子館;;台北免費公社推薦|| 空間好大的萬華親子館 媲美親子餐廳不落漆;捷運劍潭站X台北免費公設推薦||空間很大 玩具很厲害的"士林親子館";捷運古亭站x親子空間||去"大樹先生的家"玩球池溜滑梯;捷運圓山站x親子咖啡||帶寶貝來一圓公主夢"繽紛樂園Pink Swan Party "扮家家酒好開心;高雄X親子餐廳||令人失望的樂樂將 地雷....;捷運 劍南站X親子活動||很適合小小孩的FUN KID FUN 樂童樂 室內親子遊樂園;捷運美食x市政府站x親子||台北信義新光A8館的伽利略親子餐廳Galilei Family Brunch 超好吃的親子餐廳;{群嬰亂舞}好大好好玩的騎士堡~美人魚的家 (京華堡);捷運士林站X親子餐廳 ||相約一歲娃 到士林捷運旁的 伊莎貝拉 親子餐廳台北免費公設推薦 || 花博旁的中山親子館 大小朋友都能玩;捷運淡水站 || 原來親子餐廳也能很好吃"小布鋇鋇親子廚房"淡水紅毛城對面;新北市免費公設推薦 ||便民的好地方 板橋新板公共托育中心 一起來群嬰亂舞;;;;用餐時間 2015 8 15拍攝使用相機 CANON EOS M3拍攝使用手機;;; 美圖手機Meitu （依現場狀況及每個人口味喜好不同，文章僅供參考）;喜歡這篇文章,也幫我們 按個讚 ,推一下飛炫葡萄媽 只想要分享帶小孩過程中不嚴肅的話題,一個新手媽媽育兒過程的開心事!喜歡飛炫葡萄媽文章的朋友 &darr;&darr;&darr;歡迎按讚加入"FB"一起討論&amp;follow 好吃好玩情報^^;飛炫葡萄媽UNIQUE 韓國連線新品 設計師新款親子穿搭 童裝;;;飛炫葡萄媽 ll美食x旅遊blog一起吃喝去;旅行是生活中最美的事情LINE ID: UNIQUE15全部現貨,可直接詢問^^~這裡紀錄,幸福的回憶;;;好玩的地方一次打包旅遊牆 旅遊邦：探索我的世界 複製分享連結;;好吃的地方都在這!美食牆 美食邦：美食、餐廳、團購 複製分享連結;;
