title,hits.total,info.comments_count,images.length,link,body
[台中沙鹿] 麻吉熊親子餐廳/室內遊戲館,18456,8,20,http://yawenliang.pixnet.net/blog/post/105836807,麻吉熊不是熊麻吉喔！六月底聽到海線地區有新的親子餐廳，決定找一個星期六下午跟小惠一起帶小孩去玩玩，這家親子餐廳是六月中才開幕的。這是第一次使用所謂的親子餐廳，過去去一些親子餐廳因為當時沒小孩，都沒用到親子設備，有小孩之後親子友善餐廳或是親子餐廳突然變得很重要。麻吉熊位置接近沙鹿火車站，過沙鹿光田醫院與星巴克之後第一個十字路口右轉大約三百公尺，非常接近平交道，餐廳旁邊的空地因為假日已經被停滿，我眼尖馬上看到對面小吃攤旁空地還剩下一個位置，太好，一來就卡到位，結果老闆出來說那邊是要留給她的客人停的。還好車不大，麻吉熊門口還能塞進一個位置，但門口的路不是很寬，來往的車子不少，停車需要一點技術，有勞小惠老公了。因為當天實在太熱又是下午三點多西曬嚴重，所以沒在外面拍照，就趕緊進去吹冷氣了！映入眼簾的餐廳的一部分：靠近門口的餐廳區，再裡面一點放了幾個 IKEA帳篷的寶寶遊戲區，以及最裡面糖果屋的大遊戲區。用餐區和寶寶遊戲區是連在一起的，而與大遊戲區有區隔開來。入口左手邊沒照到的部分是餐廳廚房。寶寶遊戲區舖有大大的巧拼地墊，有一些靜態的益智玩具和大型泡棉積木、帳篷和圓形鑽龍，蠻適合小小孩或是爬行的嬰兒。注意到上方有投影機和布幕，應該可以在這裡辦慶生或是抓周的活動。;大遊戲區共有四層，第一層入口的大球池，阿芃顯然把這裡當成游泳池（右圖整個趴下去進行蛙式），沒辦法，她第一次看到這種東西。;球池中有一個大大的爬坡，爬上去是所謂的第二層，可從另一端的溜滑梯溜到球池。她膽子很大，爬坡明明快要跌下來的樣子也不怕，雖然放手讓她玩，但是小小孩玩大人在旁邊顧著比較好。(兩位看別人爬坡看的這麼認真) ;射球砲台，可以玩很久，球從旁邊吸入從中間砲台衝出來，不過掉下來砸到頭好痛！大人頭大命中率更高，要小心點。;第一層還有好幾個盪鞦韆和翹翹板，不過看照片會發現這個地方有點暗。;馬上跳上搖搖馬，搖個幾下看到更好玩的跳床。因為還不會跳也不知道怎麼玩，後來一個葛格過來蹦蹦跳，她馬上逃離現場XD。在球池與爬坡數次之後，就一路往上，每一層都上去了。而類似像這種空中走廊還是橋的器材會折返不敢往前，我也不敢過去是因為不知道它承重多少，好怕掉下去，所以我們兩個就這樣戰戰兢兢的一路往下爬，旋轉滑梯跟大滑梯都沒玩，看到其他大小孩玩得很瘋，大人不需要跟前跟後蠻輕鬆的，上面這幾層都很適合大小孩。膽大芃在這裡變成抖抖芃。大遊樂區限制：小孩125公分以內，30公斤以內才可進入．之後上網才看到這個，三十公斤以下才可進入，不過店家有回應可以有一個大人上去第二到第四層救小孩。越往上走越熱，糖果屋大遊戲區是鐵皮搭建的，只有一台分離式冷氣機，第三四層蠻熱的，我在粉絲頁看到因為太多人反應，店家最近有加裝冷氣。餐點屬於點心式的：鬆餅、咖啡、茶類。因為我們午飯過後才去，點了蜂蜜鬆餅、火腿鬆餅和兩杯茶，另外還有免費飲用水喝到飽。火腿鬆餅不是很推，鬆餅還是甜的好吃。後來因應觀眾要求，終於推出正餐類，這樣大人才吃得飽阿。;假象假象，動作一致的兩位，遊戲區還是比較吸引他們！吃幾口又跳下來衝進去消耗體力。喝的是店家的飲用水和原味鬆餅(沒沾蜂蜜)。這個餐廳規定大遊樂區內賓客必須穿著襪子，比較安全及衛生，小人兒當天穿涼鞋，回家之後才知道餐廳有在賣襪子，所以以上為不良示範，金價歹勢！費用：周六下午時段我們沒有預約，不過建議假日人多先預約會比較好。小孩350元(限一名成人陪同)，多一個陪同大人加收100元，每張票可折抵 50元消費，點了餐點後三大兩小，總共花費980元。優點：遊戲區大免服務費免費wifi有育嬰室尿布台(只去洗手就沒有照到照片)店家服務態度佳缺點：停車不便正餐餐點選擇少太熱(七月初店家加裝冷氣);麻吉熊的亮點我覺得會是在遊戲區的部分而不是在餐點上面，因為餐點不算精緻，但遊戲區夠大，又有四層很夠玩，阿芃一上車就睡著，顯示為被操到。不過我認為會適合再大一點的小孩，1y8m這時還需要看著，而餐廳離遊戲區距離很遠，沒辦法邊用餐邊看小孩，如果要帶小小孩去，多幾位大人一起去輪流顧小孩會比較輕鬆一點。不過店家服務態度佳是一個優點，上面列的缺點店家也嘗試改善，希望設備與服務可以更好，也希望海線有更多不錯的親子餐廳可以去！;【麻吉熊親子餐廳】;消費時間：2014/06;電話：04-26367209地址：台中市沙鹿區興安路49號預約時段週一: 10:00 - 21:00 週三 - 週日: 10:00 - 21:00; 週二店休餐點：午餐、晚餐、咖啡、飲料;假日限時兩小時，先預約比較保險路邊停車有兒童餐椅店家網址：https://sites.google.com/site/36machibear/
【木柵 親子館】文山親子館／台北市文山托育中心　2013/7/30開幕,12014,2,104,http://star3669.pixnet.net/blog/post/167724287-%e3%80%90%e6%9c%a8%e6%9f%b5-%e8%a6%aa%e5%ad%90%e9%a4%a8%e3%80%91%e6%96%87%e5%b1%b1%e8%a6%aa%e5%ad%90%e9%a4%a8%ef%bc%8f%e5%8f%b0%e5%8c%97%e5%b8%82%e6%96%87%e5%b1%b1%e6%89%98,用"媽媽的角度"看世界後，發現很多的不一樣;今天來到位於木柵的文山親子館這是台北市第二家採複合式建置的親子托嬰館在全聯的右邊樓梯上去是文山親子館;兩邊的走道旁上方也有巧思造景;因剛開幕，所以門口一堆花籃，真喜氣 ;;為了控管使用品質，每場次限制50對親子使用(35對網路或電話預約，15對現場排隊);櫃檯服務員電話接不完，因聽說第一天網路整個爆滿進不了;一入館內左手邊就有洗手檯，請先幫孩子換好鞋子後，洗完手在入館內玩，請愛自己也愛別人;正前方是一排鞋櫃鞋櫃上方小朋友休息時可以坐在上面吃點東西右邊則是擺放包包的置物櫃;櫃子旁邊有賣襪子的機器，忘記穿襪子又突然想來排現場的媽媽們可以來這買喔!望眼一看，只能說 ; 超級大間 ; ;我的相機用全景也真沒辦法拍完全部的空間呢！;;館內規劃則是分別為:感覺統合區、手創區、建構區、舞台扮演區、大型體能活動區、繪本區、展示區及多功能教室。;;舞台扮演區格子內其實應該有很多角色扮演的衣服，但是我們太晚到，一件都不剩了旁邊也有手偶布娃娃，可以用來講故事，使得故事更生動活潑喔 大型體能活動區;;繪本區 有不少很有名的童書繪本，真是造福不喜歡買書的媽媽福音阿;;手創區 ;使用無毒的果漾彩繪筆小朋友使用真安心還有很多環保教材可以讓小朋友自己動手剪剪貼貼，既環保又安全感覺統合區;;;有像這樣可以扶的又有鏡子的教材，讓學走的寶寶的媽咪好安心 ;;磁鐵玩具多功能教室;附洗手台，記得讓玩完玩具的小朋友養成洗手的好習慣喔教材都放在櫃子裡，櫃外面直接有圖可以看到，挺方便的;;建構區;屬於積木及辦家家酒類;;哺乳室;哺乳室內的飲水機才有溫水喔!;; ;在廁所旁邊的這台，因為怕小孩子觸摸到，所以只提供冷水 ;;;;;;;尿布檯在廁所(男女皆有)動物遊樂園有超多好玩的小玩具跟布娃娃;;;這個地板很特別，分別貼上不同觸感的物體來刺激寶寶腳穴   ;用紙箱做的熊與鱷魚 ; ;;;大型的多功能玩具轉轉樂;用紙箱做的巧虎黏球組; 幾個有趣小玩具 ;; ;;;;;中間還有像這樣的休息區 ;;;;;;; ;; ;;;;;;;;;;;;;;;;;;; ;;;;而從全聯外面有電梯做到二樓是台北市第五家的文山區公辦民營托嬰中心昨天開幕;參觀後採隔間式的分齡收托，分別為娃娃班(2m-7m)最多10人、寶寶班(8m-14m)最多15人、幼幼班(15m-2y)最多15人分所以整間托嬰中心只有40個小朋友，老師比例是1:5然後針對不同年齡層嬰幼兒的需求及刺激，設置所需要的設施，大小孩不會互相干擾。 ;;一入內就有老師在講解報名抽籤的內容 ;開幕那天半的抓周活動;還有一堆車車!! 宇揚的最愛;os:怎麼不是在親子館內....;   ;;;;   ;;       ;;;; ; ; ;;;番外篇:宇揚在親子館內，推了這白色的櫃子 ;然後當下有哭，但是我不以為意，後來來參觀托嬰中心時，才發現流血當下老師直接請我進去保健室幫宇揚擦藥，真是揪感心耶~;大推阿; ; ; ;;;文山親子館★地址: 臺北市文山區木柵路1段177號2樓★電話: 02-2236-5186★時段: 週二至週五9:30~12:00、14:00~17:00週六及週日9:30~11:00、13:00~14:30、15:30~17:00★貼心小提醒: 每場限50對親子使用，其中35對網路或電話預約，15對現場排隊~★網址:;https://taipei.parent-child.org.tw/index.php?md=index&amp;cl=index&amp;at=index&amp;pfid=12;;文山托嬰中心服務對象為設籍臺北市滿2足月至未滿2足歲嬰幼兒，收托人數40名。收費每月11,000元。收托時間為週一至週五上午7時30分至下午6時30分，得視需要提供延托或臨托服務。7月30日至8月9日開放參觀，並同步受理報名登記；8月1日及8月4日召開招生說明會。8月10日9時公開抽籤，同日下午3時於文山托嬰中心及社會局網站公告結果，預定8月19日起正式收托。相關訊息請洽該中心2236-1388。;;延伸閱讀相關親子資訊舊文連結:【全台 親子館 】彙整各地親子館資訊 (2013/7/31更新);【基隆 親子館】基隆市安樂托育資源中心(基隆婦幼中心3樓);【大安 親子館】BabyPlay寶悅親子樂園;【西門町 親子館】又又星樂園;【松山 親子館】童心園 weplay親子館 體驗趣;;
[遊記]基隆海科館 八斗子Artr彩繪親子餐廳,19394,1,30,http://rengshiun.pixnet.net/blog/post/251758060,; ;;; 前兩周因為嫩芽爸出差南部的關係, 所以我們全家跟著他在南部待了快兩周, 好不容易工作事情解決才回到台北,想說很久沒跟朋友約出去聚聚了,於是趁著周末假日上網看看有沒有不錯的地方可以聚聚, 現在有了小孩, ;凡事都要考慮到小孩,跟朋友聚會的餐廳, 也是以親子餐廳當首選了,很幸運找到了一間在基隆海科館,才在試營運的八斗子Artr彩繪親子餐廳,他是採預約制,馬上打電話去預約,雖然是去的前一天才打 ,但可能是試營運期間還沒有很多人知道,所以很幸運的一下就訂到了位置!;;;;; 到了海科館, 找了一下位置,原來Artr是在海科館右方的探索區域館4F,不是真的在海科館本館內,一坐電梯上四樓就到了,童趣的佈置一眼就知道是間親子餐廳Artr入口處在外面看還真不知道,裡面的空間真的是超大的,也分好幾個遊戲區,由服務人員帶領先找到我們的座位, 空間真的超級大,非常的舒服色彩繽紛的開水壺,很有特色,也成為餐廳裡佈置的一部分,讓人眼睛一亮跟服務人員點完餐趁餐還沒上連媽媽我自己都已經迫不及待想把餐廳繞一圈看看遊戲空間有好幾區,從這一區旁邊沙發上方的窗戶,看出去就是港口,可以看八斗子漁港呢由窗戶看出去的景色,天氣好時我想景色一定更美繞餐廳一圈後,餐點已陸陸續續上了,於是我們就先回到了座位上我們有點套餐,套餐是一份主餐+120元,有一份前菜沙拉,及磨菇濃湯或附餐飲料任選嫩芽爸的義大利獵人雞肉燉飯小人套餐, 我們點的是番茄肉丸通心麵,也有一份蘑菇濃湯, 套餐內除了有水果還附有一根棒棒糖及一包Kid-O餅乾,設計的真的很得小人的心,嫩嫩一看到棒棒糖就超級興奮的瞧嫩吃到棒棒糖開心的模樣媽媽我的椒鹽松阪豬燉飯,在這邊小小抱怨一下,這松阪豬我吃到最後兩三塊時,發現豬肉煎得不是很熟,肉是呈現粉色的,咬就知道根本沒熟也咬不下去,跟服務人員反應,去幫我問了廚房,回答說松阪豬本來就要吃九分熟, 不能太熟就不好吃了, 這我當然知道啊, 以為我沒在下廚嗎?;問題是肉沒熟根本咬不下去,是要我硬吞嗎?廚師你自己火候沒有拿捏好沒煎好就承認嘛我只是希望你弄熟後我可以繼續吃, 這樣浪費了我三塊松阪豬, 反應了問題後這種說法,其實沒辦法讓人信服也不是很滿意,;但除了這點外,對於小人的空間設施部分,我是還算滿意這一區除了軌道車,可看港口景色, ;另外有放置大型積木,還有軟性玩具,很多布玩偶及書,這一區還蠻適合小小孩的!;光看這一區就覺得空間已經很大了吧, 但這只是其中一區而已, 再來看看別區這個空間的另外一面就是玻璃彩繪牆,彩繪筆放在旁邊桌子上, 可以任意取用,一大面的玻璃, 可以讓小人任意畫畫這一區是玩沙區,在親子餐廳中,很少會附設玩沙區, 通常在親子樂園會比較常看到,畢竟這要清理也蠻費工的, 所以Artr有附設玩沙區真的蠻特別的,而且令人非常意外的,他的沙真的超級乾淨的,芽芽一個人可以在那邊玩快一個小時不起來,我過去抱起他時,輕輕拍拍衣服上的沙就全都掉下來了 , 手上也沒有黏到沙那種不舒服的感覺,真的很意外,後來聽跟工作人員說才知道,別看這小小一池沙,也要要價上萬塊呢!光是這個玩沙區,可以耗掉小人不少時間,都可以自己乖乖的坐在裡面玩再來看這一區,裡面附設的都是廚房玩具,這一區設計得也很有海港元素這一區裡面附的廚房道具,很多都是用紙箱做成的道具,有種廢物利用的教育意義,還蠻特別的雖然沒有像Mother Garden廚房玩具這麼精緻可愛 ,但小人們感覺也是玩得很開心,是啊!其實小孩們哪懂這玩具質感好不好,貴不貴,其實這個概念蠻好的,用不要的廢棄紙箱做成的玩具還不是一樣玩得很開心呢!;再來到另外一區,這區感覺就是基本款了, 有Rody跳跳馬, 溜滑梯等等...也可耗掉小人不少精力再來就是靠近入口處有一區專門規劃給小孩塗鴉彩繪的地方, 如果怕弄髒衣服,現場也有提供圍兜給小朋友們穿,就不怕弄髒衣服了小朋友都畫得很開心,不過嫩芽好像對這區並不特別感興趣,;沒有跟我們說要去玩,所以也就沒過去畫了;最後附上一張芽芽搞笑照,最近叫他嘴巴張開,芽妹她就會把嘴巴張得超級誇張的大,臉都皺成一團好像深怕別人看不清楚的感覺, 超爆笑的!!整體而言,Artr的CP值還算不錯, 如果不是來用餐,只是來喝喝咖啡聊聊天,我覺得也不錯,現在嫩芽她們已經慢慢可以自己玩,有時自己玩自己的,或有時兩個玩在一起,;大人們只要在旁邊稍微看一下陪著就好了,已經有越來越輕鬆的感覺了, 所以帶著小人點杯飲料跟三五好友來這邊聚聚聊天還算是輕鬆不錯的好選擇!;海科館Artr彩繪親子餐廳好像還沒自己的網頁,有興趣可以上FB參考一下https://www.facebook.com/artrwatercolor或海科館的官方網址:http://www.nmmst.gov.tw/chhtml/index.aspx地址:基隆市中正區北寧路367號 （區域探索館4樓)訂位專線:02-24693496;推薦給大家!;;
伽利略親子餐廳搬家到石牌了,38222,5,23,http://maybird.pixnet.net/blog/post/32054793,昨天又去吃，還是很不錯阿開在石牌的振興醫院門口，隔壁是星巴克還有出清他們的舊餐具^^這種設計師的嬰兒椅，小孩太大會坐不下或是卡住，幸好弟弟還小店內的風格一樣很原木風有一整塊突出去的遊戲區早餐1號好吃濃湯與麵包都很好吃遊戲區其實比信義區那間的大很多了，不過一樣是一小區它們2014六月要搬家了唷，伽利略搬家到台北市北投區振興街35號營業時間:1000~2100(用餐時間2小時）電話:02-282629882016.5.19寫的2014.5.19-------------2013.5.6寫的這間很不錯啊，陽光充足明亮，但是最好平日上午來，沒有人簡直包場餐點讚!!!這是帕尼尼~~超好吃的三明治蛋包飯也好好吃~~大人的餐點約300多，10歲以下可以點兒童餐，兒童餐180元(我們這種兩歲的其實可以不用點餐)剛開始她自己一個人還不知道怎麼玩真的很舒服(這是二樓)一樓也很漂亮過12點之後人很多了，反而開始搶玩具...大家都想騎那台車平日早上來真的不錯，可惜只有這樣一區可以玩，這裡適合2歲~3歲伽利略搬家到台北市北投區振興街35號營業時間:1000~2100(用餐時間2小時）電話:02-28262988(一定要先訂位阿~劍潭捷運站有公車可以到科教館，在附近而已)
親子體適能遊戲 ,436,0,0,http://ailsa0221.pixnet.net/blog/post/70122533,;慶祝父親節免費親子體適能遊戲由新苗體能工作室的可愛活潑的西瓜老師來和大家一起過一個好玩有趣的父親節;親愛的爸爸們為自己和孩子留下一個難忘的甜美回憶吧！活動內容： 親子體能律動、幼兒體能運動、親子體適能遊戲活動時間：100年8月6日 星期六 早上10點活動地點：台北市龍江路397巷12號1樓報名電話： 25097435;聯絡EMail;:;lojakid@yahoo.com.tw名額有限;; 請儘速報名;; 以免向偶
戶外PG--20150529 Go Bear溝貝親子休閒農莊,2327,1,38,http://cinnie.pixnet.net/blog/post/42432934, ;;這週的PG時間來到一個非常優質的親子園地今年2015年5月才開幕的新竹竹北「Go Bear溝貝親子休閒農莊」來來來~~是棒在哪裡呢??炎炎夏日玩水戲沙撈魚，竟然可以不用怕太陽公公毒舌紋身光這點就無敵了~~;所以我們優雅育兒高手咪寶媽立刻就幫我們預約，4台車5大7小就這樣興高采列的出發了~;可惜陶墨媽我寫PG網誌也是年久失修又生疏，現在還多了個小墨弟跟著姐姐PG，抱著小孩拿個行李或推個推車忙完想要再騰個手拿相機出來拍時，小朋友已經都衝進水裡啦~~^^;(還在思考要不要幫兒子脫褲子，他老兄已經一屁股坐下去了XD) ;清涼乾淨的水池裡，放著彩色小魚、章魚玩具還有鋪上乾淨的白細沙，踏上去清涼腳底又舒服之外還有2大優點：;1)幾乎不怕小朋友會滑倒，柔柔細沙比PU緩衝跑道還棒;2)水很淺很淺，像我們才74cm的小隻墨和甫弟進去泡著也不過腳踝，對這種走路都還走不穩的小朋友，也可以像2~3歲姐姐一樣盡情玩水，不用老被大人抓著活動不自在(有時還會放聲大哭@@)，也不用累壞馬麻還吃力不討好，讓我這個媽媽由衷地跪謝這塊世外沙園啊~~~(馬麻輕鬆拍照中~咔喳咔喳);(還有七彩小寶石，粉紅控的陶陶和咪寶不停尋找粉色小彩石); ;結果阿墨和甫甫幾乎定格玩水，沒有像哥哥姐姐到處走來走去，怕他們披著濕衣會冷，結果就放小鮮肉包2枚出籠了^^;這區玩水的空間大嗎??不怕日晒嗎??補上一張全景圖，是不是超大的啊^^~原來以前這裡是鈞蝦場，現在的老闆創意思考改變經營方向，善用原本的空間才能有那麼大的戲水場。; ;;(連大人都下水也不會擁擠) ;;只有這裡可以玩嗎??錯囉~於是大家開始轉戰小沙坑小沙坑是在半戶外，一樣也有遮陽不日晒，四週又都是田地，風大的日子陣陣涼風拂面，真的一點也不熱，而且好神奇沒有什麼蚊子，光這點也是狂勝很多有名親子景點。(豎大拇哥);(陶咪姐妹花從小一起玩沙玩到) ;;(喬喬和大星又偷偷一組親密填沙中，大家都玩好開心); ;;;補沙坑全景---- ;;看著孩子玩沙玩到一半，有些好奇地跑去看看2個紅磚石牆裡是什麼東西，原來是紅色大螯蝦!!!!;;;(一節節小水管是螯蝦們的家) ;;原來這裡還可玩釣螯蝦，老闆會準備一些鮮肉夾在釣桿上，咪寶媽率先釣給小朋友看，小朋友全都一臉嘖嘖稱奇~~;;(緊抓小鮮肉的螯蝦說什麼也不放手);(被放入小水桶也在所不惜，還好我們沒有要吃你，算你幸運~^^);;;(其實小朋友有都有點不太敢釣，反而是大人玩得不亦樂乎) ;;玩完了嗎???還~~~~沒~~~~~我們在外頭又發現了一個圓形小水池，有真正的魚兒魚兒水中游，老闆說可以下去撈魚，付了押金還可以提供小網子和水桶。等我拿好好桶子，又有2位早就泡在裡頭XD ;;;每一隻都像是噴射魚跑給娃追，我們的小女生動作也秀氣，所以當然都撈不太到XD ;;果然撈不到的林小陶開始鬼叫要馬麻撈，只好試範輕手輕腳地撈魚術，撈到一隻給她瞧這小妮子樂得直喊：「我馬麻幫我撈到一隻魚了」;厚~~撈魚~~你不知你娘小時候是在溪水邊長大的嗎??(輕撥耳際髮絲~);;;(唷~~好像是妹姑母女檔的成果嗎??^^) ;;(小嬰兒的夏日生態營^^) ;;戲魚池全景照--7個小娃全下水還是很有空間，而且水池上方正好是大樹為我們庇蔭不用酷晒，;有太陽的地方又把水温晒得暖暖的，;所以玩久也不會覺得冷喔~ ;;;好啦~~小朋友開始吵著餓了，媽媽們手忙腳亂地把小朋友抓起來沖洗換衣，老闆正好也端上我們預約時就訂好的餐點----嫩牛肉套餐飯的份量不夠的話還可以加飯，牛肉夠軟適合小朋友，聽說其他餐點也很不錯吃喔~;;廳內全景圖----室內是沒有冷氣的，但今天風大倒也不覺得悶熱，忍不住問了老闆若是7,8月盛暑的時候，是如何解決沒有冷氣問題老闆說其實這一帶風都很大，四週又都是田地，所以本來通風不會太熱，正夏時再多幾台大台電風扇吹，其實室內一樣很涼爽，再加上小朋友若在室內玩水濕漉漉，也不適合有冷氣吹送。其實我也喜歡讓小朋友多接觸自然風，這個好處實在也是不可多得^^;;;;上廁所的話就是在這個成人釣魚區後面那個建築物，在戶外的廁所總是讓人有些害怕，但帶陶去上廁所時廁所乾淨沒有異味，也沒有惱人蒼蠅蚊子亂飛，連如廁的經驗也讓人那麼愉快啊^^~;;;;吃完飯了，媽媽們聊天聊得開心，小朋友就在室內衝來衝去，今天是平日人少，就在餐桌餐椅上爬來爬去，看池內的小朋友玩樂當然媽媽們還是要看著注意安全...; ;;差不多要回家了嗎??哪有~~老闆後來還很熱心介紹好玩的桌遊給我們玩，要把抽到動物放到諾亞方舟上保持平衡不能掉下來~;;(結果變是媽媽們在玩，看得出來都非常小心翼翼地擠在中間XD);(還有這組抓猴子的也很適合小朋友) ;;眼看著從10點就玩到快要2點了，陶墨媽我4點還要上課(累)，覺得差不多要把陶墨雙寶帶回家睡午覺時，老闆竟然邊加水邊對我說：「來來來~我快裝好水了，小朋友還可以像夜市一樣來釣魚。」什麼!!!!還有別的可以玩???我只能說母愛是偉大的，雖然腰一整個酸死人了，還是留下來讓陶墨多玩了半個多小時，;;;一樣又是鬼叫釣不到魚，馬麻只好又彎著腰教這小妮子，瞧她釣起來時又得意大喊：「你看我馬麻幫我釣到粉紅色的!!!」;厚~~~釣魚~~你不知道你媽小時候是在夜市裡混大的嗎??(太妹蹲XD) ;(有沒有看到我們家阿墨已經累到在頻頻揉眼睛了...);看到這一幕，真的不能再留戀，幫孩子再換上第三套乾淨的衣服，阿墨連車子都還來不及上，就已經在推車上睡著了，可見玩得有多累。最後來張PG大合照，還好在玩戲魚池就拍好了，;(耶~~~今日PG戲水遊大成功--我兒子好配合XD) ;;(噗~意猶未盡的我們又預約了下星期四要去玩，有沒有人要一起去啊^^) ;;夏天想要帶孩子們玩水的朋友們，真的很推薦這裡;貼上FB官網給大家參考https://www.facebook.com/gobear.twc?fref=ts想要去玩的人記得先預約喔~~;最後，一樣獻上幾張趣味照，迷你PG網誌下回見囉^^-----------------------------------------------;一手抱阿墨，另一手還要抓著陶陶釣螯蝦，阿墨還很努力地拿著水桶要裝蝦，只是陶墨媽我腰差點沒斷掉，阿墨也差點沒掉到池裡變成真正的小鮮肉XD;;(陶墨媽表示：我都沒有玩到，我也要玩) ;(那個....林小墨先生，魚在你的後面，不是在草裡好嗎!!);(林小陶，我們玩桌遊，你怎麼在有種聚賭氣勢呢~噗) ;;;;哈哈哈~~因為馬麻們交待要小心不要掉進去，所以大家都壓低身子超小心~ ;~end~;
