title,site_category,hits.total,info.comments_count,images.length,link,body
9/24, 小虎玩律動(2012.09.18 小鴨子老師),親子育兒,657,5,23,http://mylittletiger.pixnet.net/blog/post/46978302, ;隨著龍二越來越大　我所能坐好的時間越來越短（因為肚子總會頂到　不舒服）可是為了不讓小虎太依賴電子產品　我仍舊不想妥協將孩子交給電視及iPad褓姆　沒有卡通可以看　就連巧虎DVD一天也只能看30分鐘要陪玩一天　媽媽體力上有點無法負荷　只好找一些律動課讓他跟著老師去唱唱跳跳　玩一些比較動態的活動　消耗一點體力;;;竹北是孩子很多的地區　家附近的社區有好多、好多的課程　（謝謝之之媽咪給了我很豐富的資訊）分攤下來　鐘點費也蠻合理　於是就決定讓小虎去上課囉！只想要讓他去放風玩樂　所以主要課程選擇的條件是：不要太靜態　要孩子乖乖坐好直到結束的至於是否能從中學到什麼太具體的事情　其實不重要　just to have fun！;;;一堂課的時間　共有60分鐘　老師是小鴨子;;;也許是第一次上課的關係　亦或本性悶騷、慢熱前30分鐘　他幾乎沒什麼反應　甚至還背對著老師（因為這樣剛好面向媽媽）老師上前來關照　也不敢正眼瞧人家　@@;;;雖然如此　對於課程中的指令　要拿東西、要做什麼　他還是會配合這次要去領娃娃........;;;小虎對娃娃本來就沒有太大的興趣　（比較喜歡的就是巧虎或是老虎的娃娃）;;;拿到粉紅色的無尾熊　一副很無奈的樣子........;;;最後勉為其難地拿起它;;;躺下來　腳做腳踏車運動;;終於展開笑顏　稍微進入狀況了些......;; ;老師說要將腳張開、合起　也都有配合喔！;;;之後拿了鈴鐺;;;藉由幫娃娃刷刷洗澡　來練習搖擺的動作;;課堂上的空擋　跟小妹妹在看風景　;; ;之後老師將小虎抓去　要他做倒立的動作　儘管還是面無表情　但是也沒有抗拒或哭鬧.........;;然後回來的時候　是這種臉　（你真的非常、非常的悶騷）;;;最後的活動　是將娃娃們都擺到直線上　然後讓孩子跨過它們　練習輕輕跳躍;;;看到思念的巧虎　偷偷跑去拿;;穿吊帶裙的之之　住在我們家附近　上課好進入狀況　老師非常喜歡她！;;由於女兒完全不需要擔心　所以之之媽媽就很照顧小虎　（謝謝妳啊）;; ;;;;課程的尾聲　小朋友排排隊領貼紙囉！　下次見！;;回家時　買了小點心補充點體力　好開心啊！;;＊後記;其實在課堂中　老師的音樂放完了　小虎就在耳邊偷偷地跟我說：還要聽回到家時　問他喜歡跳舞嗎？他點點頭；那下星期再去上課好嗎？微笑說好　我想　小虎應該是蠻喜歡律動課程的吧！　:);;;; ;
[親子]超FUN.超好玩的質感親子空間。內湖 樂童樂室內親子遊樂園 Fun Kid Fun Indoor Playground,親子育兒,50026,5,83,http://smi1014.pixnet.net/blog/post/346561913, ;樂童樂2015.12月改裝完成啦!!! 新文章請點--【親子】樂童樂室內親子遊樂園 親子餐廳(Fun Kid Fun Indoor Playground)。改裝後球池變超大沙池寶貝更FUN了。餐點現做健康又美味。內湖大直 捷運劍南路站;呦呼~又有一個好地方可以專門溜小孩啦!!今天,我和豆豆媽相約過年前小聚一下想也知道有帶小孩一定是走"親子"路線 哈早上我們就帶著兩個小人到內湖大直新開的【樂童樂室內親子遊樂園 Fun Kid Fun Indoor Playground】;這和一般的親子餐廳不一樣喔!比較偏向親子的室內遊樂場 很多東西可以消耗皮蛋的體力啊!((我就是需要這種地方 顆顆));位在美麗華旁的樂童樂室內親子遊樂園 Fun Kid Fun Indoor Playground 還蠻好找的對面就有很大片的停車場 離劍南捷運站不遠交通非常便利喔!; ;我們很聰明的10:30就到了 顆顆因為不想人擠人啊 早點去人比較少喔!占地180坪的室內遊樂場 又是挑高的空間;一進來就覺得很寬敞舒服;在這邊除了要脫鞋進入外規定大人一定要穿襪子這樣才衛生;小朋友不穿襪比較安全喔!門口的黑板牆上寫得很清楚收費標準買票後服務人員也會規定要先量體溫,消毒雙手衛生管理非常細心呢!;其實,收費的準則和騎士堡很類似有分小時和全日 還多了臨托的部分 ((可能媽媽想好好逛街時可以派上用場 哈哈));一開始我只打算玩2個小時因為朋友有給我買一小時送一小時的折價券我帶米寶去騎士堡一個小時我就快累翻了 要一直跟著小孩所以,我和豆想說玩兩個小時就差不多 再到美麗華吃個飯;整個行程非常好挖!在這裡一個1~8歲的小朋友可以免費有兩位大人和一位一歲以下的小人陪同進場這樣只要全日的話599元!! 超及划算的啦~~結果~對! 我先告知玩完的結果~~~2個小時竟然有不夠玩的FU啊!!哈哈哈哈 這裡真的太好玩啦......而且.有很多大哥哥大姊姊幫忙看著小朋友我和米寶爸竟然覺得不累耶 ((灑花)) ;門口左手邊也有販賣場內的玩具和故事書;都是國外進口的光那個動物的頭我就覺得好可愛很適合裝飾小朋友的房間耶!; ;有帶大包小包的媽媽們 入口處也有免費的置物箱可以使用全館除了喝水禁止飲食建議媽媽可以把大包包放置物櫃再帶個小提袋裝著相機.手機.水壺這樣就可以輕鬆地陪著小朋友一起玩 不怕落東落西的 ;這邊分成兩層樓一樓的部分有一個很大的恐龍球池;裡面還有一個跳跳床非常適合活動力十足的小孩來消耗體力左手邊有一面很大的黑板牆可以讓小朋友盡情畫畫用的都是無毒無粉塵粉筆 讓小屁孩可以自由發揮滿足愛亂畫的天性啊! 哈哈另外,還有一小區小小爬行區 讓年紀比較小的小朋友可以玩玩球 ;;這隻大大的蛇頸龍就吊在半空中 超酷炫的這個大型跳跳充氣床 真的是很多小朋友的最愛早點來比較不用和大家擠遊樂設施旁都會有工作人員大姊姊看著小朋友 注意安全 ;球池裡還有溜滑梯和吊橋設施;可以讓小孩爬上爬下;米寶一開始就跟著小哥哥一起去玩溜滑梯啦~;;;;這小子真的是個很小心的小孩走吊橋也是一步一步地走 哈哈 ;;連玩個溜滑梯也一定要扶著不敢雙手抱胸 哈哈平常的霸氣去哪了啦!!!不過,這個溜滑梯真的還蠻快的 哈還好都會有大姊姊看著 我比較不擔心大姐姐也會和小朋友有互動難怪小孩會玩得很開心 顆顆 ;你看~他玩到衣不蔽體了啦!來這裡一定要穿著輕鬆的服裝 才能讓他們大動作的玩耍啦!其實我們在這一區沒有停很久因為,我從前一天就告訴他...明天要帶你去開車車,還有AUDI的喔......大概在溜滑他這邊玩10分鐘他就想去2樓開車了! 哈不愧是男人啊!!!!!!最後,妮妮也加入啦!不過他還, 還不太會玩溜滑梯什麼的走~走~我們去2樓看看吧! ;;二樓的部分真的是我超推薦的地方!裡面的玩具都好細緻 也超有質感的和一般的親子遊樂場所都不一樣呢!! ;2樓這邊有一個奇幻蘑菇農莊小朋友可以玩一玩農場遊戲自己摘採新鮮的蔬菜水果 ;你看看蘿蔔彷彿重在土裡一樣 這樣擺飾好可愛喔!小朋友可以來玩拔蘿蔔啦~ ;樹上也有水果可以摘採ㄋㄟ這一組切切水果的遊戲組我們家也有買小朋友都很愛玩切菜的遊戲把他掛在樹上 滿足小朋友採水果的樂趣 還真有創意;;;;旁邊就是我最愛的動物頭啦! 是不是每個都好可愛~Fun Kid Fun獨家代理的這個動物頭 質感超好爸媽可以引導小朋友配對動物的頭和身體讓小朋友更認識動物喲!大象的頭配乳牛的身體 哈哈 好好笑喔! ;我最愛的就是這隻長頸鹿!是不是質感100分啦~~~裝飾小朋友的房間真的會可愛到爆 ;;另一邊就是主戰場--商店街啦!!所有的小朋友都會擠在這邊 因為太有趣了!;這個商店街裡有超市.冰淇淋店.車廠.餐廳.書店;外圍還是仿真車道你說說 誰不愛~~~老娘自己都愛到爆了! ;一開始先來看看車廠部分!目前剩下兩台不能出動的車場內會管制電動車的數量 以免太過壅擠不能出動的,就在這邊可以拍拍照啦! ;好啦~頂多盧出來一咪咪而已喔!我們還是很有公德心 拍完照有放回車廠裡以免別的小朋友撞到喔! ;車廠裡還有修車工具!!玩遍各大親子餐廳 這一組我還第一次看到這真的太像真的啦~~~還是知名品牌BOSCH的!個人覺得那把電鋸太像德州電鋸殺人狂了 哈哈還會發出電鋸的聲音;;電鑽也仿真到不行 太酷了!! ;;仿真車道的部分連紅綠燈都有讓小朋友開車的時候也要遵守交通規則;;場內今天開放AUDI((當初想買的那台))和藍寶堅尼((就我家也有那一台啦))小朋友在開車的時候都會有工作人員隨車在旁邊注意安全如果想要開車就在這個路口排隊人多的話大概開個一圈就會請小朋友輪流玩 ;像米寶是會自己開車這種的 就可以用自動模式自己玩如果不會開或比較小的小朋友 也可以轉成遙控模式爸媽陪在身後遙控電動車;哀~看著這張照片....又有股淡淡的哀愁你看! 他自己開車走了~~~嗚好獨立的小子!!今天妍妍姐姐也有來玩好久不見~長大好多嚕!!變得越來越可愛了~ ;;仿真車道不只一般平順的路還有一些斜坡.彎道 真的好像在考駕照喔! 哈哈米寶超愛這台AUDI 質感很好;家裡沒有電動車的小朋友 可以帶來這裡玩一玩就好一台不便宜ㄋㄟ 而且會很佔空間 哈哈((過來人的心聲.......;我家的藍寶堅尼目前都放在角落......)) ;;再來就要介紹一下我個人稱讚不已的商店街部分!平常我們到親子餐廳玩也可以玩到一些廚具組;不過都只有一台 大家搶著玩在樂童樂室內親子遊樂園 是 一 整 區!!!!是的~是一整個有體系的一區耶 哈哈哈我在一旁拍照 一邊聽到很多媽媽讚嘆地說:好有質感喔! 好棒喔!.......;從購買食材的超市 還有餐廳 甜點店......我好像看到日本的節目 叫小朋友到商店街買指定的東西 這樣! 哈;節目開始~~~~請米寶先到超市購買食材! 哈哈連推車都有 誰不被迷惑啦~ ;超市裡各種食材都有水果,魚,肉,雞蛋,牛奶.....連切菜的鉆板和菜刀都有哩!這些食材玩具我非常推薦 ((因為我家也有))都是進口無毒的原木玩具;和一般看到的塑膠那種不一樣這邊的食材更多種 有的我還沒看過哩 哈;寶哥你買了什麼!幹嘛給我買整鍋的西瓜 哈哈 ;妮妮還小,媽媽也順便機會教育一下來~這是草莓喲!! ;;把把麻麻可以當店長選完食材,旁邊還有收銀機可以結帳 哈 ;天啊~滿車的食材拍起來真的太可愛啦!!!! ;除了超市外,對面還有甜點店喔!上面好多組合式小蛋糕 看著媽媽都餓了啦!;; ;;買完後我們就要回餐廳煮菜啦!這裡的廚具組也都是原木的重點是,也太豪華了吧~和家裡的廚房有什麼不同啦~流理臺,廚具組,還有烤麵包機.......太過分了 哈哈;連果汁機,攪拌機,咖啡機 通通都有ㄋㄟ! ;緊接著,小廚師米寶就要大展身手啦!!! ;調味罐也有!!! 太讚~太讚了!;米寶非常喜歡玩廚具組不管到哪個親子餐廳 有一組廚具組他就可以玩好久我想,他長大一定想當廚師他連食材放下去後要加調味這些步驟都會一步步做好耶!;;;餐廳也有收銀機!是真的會打開 還可以刷卡的那種;一切真的都超專業的;;妮妮小廚娘 連1Y5M的小朋友都可以駕馭;; ;我怎麼還有時間可以拍照 哈哈因為這邊都有服務人員會在旁邊看管對我來說真的好省事也省力呦但,我還是會在孩子旁邊看著啦~ ;除了比較動態的部分外這邊也有一個小小書店和一些益智類的小玩具小書店內的讀物都是可以隨意借閱喜歡看書的小朋友一定會很愛這裡;;益智類的小玩具 適合喜歡動腦力的小朋友們; ; ;拿了書本或玩具後都可以到旁邊的小廣場上閱讀玩耍看看媽媽念故事書給小孩聽是多麼溫馨的畫面啊~我兒子不知的飄到那個激動的設施去了 哈哈少羿哥哥會自己坐著看書 怎麼那麼乖巧啦! ;最後,還有一個是可以讓爸媽放鬆喘息的福利區那就是手作FUN;主題每天都會更換喔~今天是應景的過年鞭炮製作;為什麼說這是爸媽的福利區哩!因為,這就像小小教室一樣會有一個工作人員 教小朋友做一些手作的小東西你也知道,小孩最聽老師的話了! 哈哈哈哈 ;原本,我以為米寶不會對這一區有興趣就在我找不到他的時候......竟然在手作區找到他!他是真的很聽老師話的小朋友 ((老師的話如同聖旨!))所以,我就很放心把他放在那一區了 哈哈哈工作人員會很有耐心一步步教小朋友做東西哈哈 他做了10幾分鐘的成品--;一根鞭炮((人家都做一串~我兒子只做一根 想必老師也hold不住他了 哈哈)) ;我終於介紹完所有遊樂設施啦! 哈除了玩樂的部分,當然育嬰室.哺乳室.親子廁所通通都有 ;順便告訴想泡ㄋㄟㄋㄟ的媽媽熱水在二樓育嬰室 會定溫在60度 適合泡ㄋㄟㄋ的溫度喔!冷開水在一樓置物區旁;啊~~這麼好玩的地方 兩個小時真的不夠啦!!!這邊的工作人員真的分擔了好多爸媽的工作 哈哈陪著小朋友玩 還協助管理設施的秩序 真的好厲害;; ;;米寶這時候在手作區,我們就不要吵他了 哈哈1歲~8歲的小朋友來到這裡一定都會玩得很開心;這個慢熱的小妞,我們都要離開了才露出笑顏!下次叫你媽自己提早一個小時到 讓你先熟悉一下 哈哈 ;;新開幕的關係,離開時還得到一顆氣球!米寶整個不想離開,我也忘了用什麼理由拐走他的 哈哈這裡真的超讚的,沒得嫌啦~下次一定要買全日票,可以不限次數自由進出;這樣玩的才過癮!!趕快來Fun Kid Fun Indoor Playground 溜小孩吧~((建議先提前"電話預約"喔~為了有良好的玩樂空間,館內目前人數限定是60人));;樂童樂室內親子遊樂園 Fun Kid Fun Indoor Playground台北市內湖區樂群三路289號1F02-8502-9915週二 - 週日: 10:00 - 20:00 ((週一公休))http://www.fun-kid-fun.comhttps://www.facebook.com/funkidfun
[板橋。親子館]   小孩玩到拉不走，大人玩到瘋狂 的好地方 ~ 麗寶百貨 POPA family主題樂園,親子育兒,11039,3,69,http://vivian681221.pixnet.net/blog/post/41405476, ;;; 首圖心聲 : 老娘我累了一天，就是為了你們這笑容。 ;;當了媽媽後，總是會有幾天必須當個 " 孝子 "，累的要命為了就是這一個笑容 !!!今天又是個親子遊囉 !!來到了離家近的 麗寶樂園 B1; POPA family主題樂園它可是全國唯一將動畫+故事+分享+手作結合的品格與情緒教育活動的主題樂園。;POPA主題樂園;位於新北板橋麗寶百貨的B1 佔地約300坪，交通非常方便，離板橋捷運1號出口走路沒幾步就到了。;本想門口拍一張的，結果二隻皮蛋拉著我往B1跑，果然講到 " 玩 " 小孩精力都很充沛。;右起分別是女兒YIMA、魔法師爸爸POPA、弟弟DUMA。;「他們的媽媽呢?」原來POPA家族是單親家庭，POPA是單親爸爸因為POPA媽媽生病過世，獨力扶養嘟瑪和依瑪。;這是由本土自製的動畫人物，不但有繪本也有DVD教導孩子的品格教育，還蠻適合親子一起共讀。; POPA主題樂園有三區，體能動畫館、親子遊戲館、輕食吧。 先大概跟大家分享一下這三區吧 !! ;體能動畫館這一區有分 6歲一下幼幼兒區還有 6歲以上小童區親子遊戲館這區是需要用代幣玩的喔 ! 輕食吧這裡是消耗體力的好地方，但也是需要補充體力的地方。如果小孩玩到肚子餓，就可以來這補充一下體力再好好玩囉 !「體能動畫館」與「親子遊戲館」兩大館不一樣的是 : ;「體能動畫館」是要購買門票進入的，主要是適合12歲以下的孩子入場遊玩。「親子遊戲館」是要換取代弊才能玩，這一區V覺得是大小通吃啦，連我也玩瘋了。;;接下 V 就好好介紹一下 體能動畫館、親子遊戲館 這二區囉 ~~;「體能動畫館」是要購買門票進入的，主要是適合12歲以下的孩子入場遊玩。也可以買套票會便宜點喔 !!;不好意思喔 !! 因為相機拍沒幾張就沒電了，所以有些是手機拍的畫質不好，請見諒囉 !;人場前也會進行量體溫、雙手消毒的動作，讓大家玩的放心。不過提醒大家要記得穿襪子喔！因為進入「體能動畫館」是需要穿著襪子的喔！ 如果忘了帶也沒関係，直接在現場買一雙是$30。  每個人手上都會有手圈，方便進出，小孩的就請大人保管囉，不然一定會不見。。。場內貼心了提供開放式置物櫃、鞋櫃、密碼式置物箱，讓你不用帶著大包小包的，可以玩的輕鬆。 好繽紛的椅子喔 !!  還有化妝檯提供大家整理服裝儀容喔 !!最棒的連吹風機也有耶 !!!連尿布台都有喔 !!! 只是。。。。建議可以裝個拉簾之類的，畢竟小孩屁屁被大家看光光也不好吧 !!小孩玩一定會不小心受點傷，連醫藥箱都準備好了喔 !!!入館後，在舞台區就開始有帶動唱的活動，讓小朋友都可以動一動開心唱跳,感覺很不錯喔!POPA主題樂園有引進工研院最新腦波意念遙控遊戲，參加的小朋友戴上頭套，透過念力來遙控遊戲。; 還可看動畫聽故事喔！這些故事都是品格教育、情緒教育方面的主題動畫。看完故事後，還會問問題，看看小朋友有沒有認真聽喔 !!我家賢哥竟也自告奮勇的上去回答。當然答對也會有個小禮物囉 ~~小小孩這邊比較屬於文靜點的區域。。。。想當老闆嗎 ??來間超級市場吧 !!!想當廚房嗎 ? 來廚房煮煮菜吧 !!想感受一下球池的魅力嗎 ?來個溜滑梯衝向球池吧！！ 還有許多工作人員在場注意小朋友的安全喔！ 想爬入毛毛蟲的肚子嗎？？ 想感受一下馬兒奔波的快感嗎?? 相教之下，小童的就比較花費體力囉~~~想鬥牛嗎??看我投幾分球 ?大大的溜滑梯讓你溜個開心。。最搶手的就是這個啦 ~~~ 打靶區，還很貼心的每隻槍旁邊都會有個小袋子讓你裝子彈。V 覺得最好玩的就是這個囉~~~騎感統合騎乘區 有貓熊、獅子、馬兒、恐龍、斑馬。。。供你選擇 !!不知怎麼騎嗎 ??有認真的哥哥教你喔 !!! 一開始喬妹還怕怕的，不過經過大哥哥指導後，會玩了就一直玩。。這是要屁股上下擺動讓動物移動，其實還蠻花力氣的喔！不光是讓你屁股動動而已喔 ! 還有個專屬的步道喔 。全程騎完大概3 ~ 5分鐘，是個很好的消耗體力的遊戲喔 !V 發現 popa 很細心喔 !!在所有設施上面都有用心注意到小孩的安全，到處都可以看到防護設計喔 !可以看到 POPA 的工作人員真的很多喔 !!穿桃紅色的都是工作人員，隨時注意小朋友的安全。POPA主題樂園平日進園是不限時間，但是假日就有限制是3小時。V 覺得要平日來比較能玩的夠本。不過因為現場有做人數的控管，還有工作人員在一旁協助，這樣才不會玩的很擁擠。;「親子遊戲館」是需要代幣來玩的喔 ! 但V建議可以申辦會員喔 !申辦會員需要100元，但也會送你100元的代幣喔 !!;V 個人覺得最棒的服務是 ~ 儲值彩票跟代幣喔 !這樣就不用將一堆彩票、代幣帶回家用不見了。; 彩票可以換小獎品喔 !! 不過要30張才能換最小獎的橡皮擦喔！; 換了代幣，看的到的都可以玩囉 !!當然也是要投代幣啦 ~~;;因為小朋友還小，所以 V 還是會選擇性讓他們玩。。。;這邊每樣大概要四枚代幣，一枚代幣是5元。;所以花個 200元就可以讓二個小孩玩的好開心喔 !!!;  ;    在輕食區旁邊桌椅，除了可以吃東西之外，還可以預約體驗;DIY兒童手作拼豆課程，$250附材料費。也是很適合親子一起動手做。    POPA 主題樂園有300坪大，結合了 動畫+故事+分享+手作。交通也方便，如果想要好好發洩小朋友的體力，這是個很棒的地方喔 !!;; 【遊玩資訊】;POPA主題樂園; ;地址：新北市板橋區縣民大道二段3號B1; (麗寶百貨廣場B1)電話：02-2272-2711營業時間：週一至週日10:00-22:00(體能動畫館清潔時段平日13:30-14:00、18:00-18:30，假日18:00-18:30，消毒後可再次入場);消費資訊：兒童399元(會員360元)家長150元(會員100元) 平日不限時,假日3小時;POPA官網： http://www.popa.com.tw/ FB：https://www.facebook.com/popafamily ;;;[親子活動] 小孩也是可以當達人 ~ BabyBoss 元本山海苔達人館;[北部。蘆洲- 奧莉維亞親子餐廳] 哥哥的生日行程~~;;[北部。板橋- 艾瑪親子館] 這。。。根本就是小朋友的天堂ㄚ;;;V女王的 五 四 三 。。。一併推廣你的粉絲專頁; ;;;;;;;;;;;;;;;;;;;;;;;;;;;;;;;;;;;;;;因應台北市政府之法規，故不另外註明官網連結、優惠活動與價位等資訊，若有需要請自行搜尋品名、官網。V女王只針對自己的使用感受來做分享唷！;;; 文內之『成份』與『功效』，引自於產品介紹，不等於聲稱具有任何療效。;; 本文為個人心得，V女王並未收受任何酬勞，並無販賣，亦無廣告推銷之意，且無受酬!!~;; 每人體質膚質皆不同，可能影響產品呈現效果，保證每個人實際使用後的狀況都相同，產品功效為商品所載，實際效果依每個人體驗為主。
