title,site_category,hits.total,info.comments_count,images.length,link,body
【親子遊戲空間】最新開幕的眠羊星樂園可以從早玩到晚，最便宜團票才250元！CP值高！＠林口昕境廣場3樓,親子育兒,58929,1,45,http://maggielin104.pixnet.net/blog/post/111374866,今天下午突然知道林口的『眠羊星樂園』開幕了，立馬包袱款一款，帶著小福星＆小福氣衝去玩耍啦！！眠羊星樂園位於林口的昕境廣場內，中小型的百貨商場還有這樣的一個親子遊戲空間真的蠻不錯的！火速跟大家分享一下林口也可以有遛小孩的好去處囉！ ;;;眠羊星樂園位於林口昕境廣場3樓（新北市林口區文化三路一段402巷2號 ） --;昕境廣場交通方式請點我 ;;眠羊星樂園是全國第一個與台灣本土的插畫品牌結合，以插畫品牌「眠羊星Sheep Planet」的角色與故事為主題的親子樂園。總共分成兩個區塊：親子體能館及各式遊戲機檯！ --;蠻類似台北板橋麗寶百貨內的Popa主題樂園！ ;;遊戲機台區有點像湯姆熊的形式  ;;;眠羊星樂園目前開幕的優惠： ;建議大家可以先用100元加入會員（會先贈送20枚遊戲機台代幣），接著就可以用會員價270元（一大一小）的優惠價進入玩耍！ --;這樣算下來是最划算唷！今天我們家兩大兩小等於是花了270元*2+100元會員卡＝640元！;另外還有一種方式是直接購買套票，10張2500元，等於平均一張票是250元！！;;要先填寫會員申請書;;加入會員的好處就是生日會有生日禮、遊戲機台的代幣買300送50～ ; ;;;;會員卡的方便性還蠻高的！ ;;入館會先量額溫、噴酒精消毒手！ ;;進來後會先看到鞋櫃、置物櫃，這邊就要請大人小孩脫鞋並且穿襪後才能入場！ ;;場內也有密碼鎖的置物櫃可以免費使用 ;;;一進來的全貌，最左邊是球池區、辦家家酒、噴球區;中間則是大型的溜滑梯;右邊是較小朋友的爬行玩耍區、騎馬區、彈跳床區！ ;;球池區 ;;;最裡面是辦家家酒區 ;;不過進來有點傻眼，總共有六組廚房遊戲，這邊服務人員並不會隨時來整理，跟台北的幼佑城堡或貝兒絲樂園比起來有點落差！ ;;噴球區，這邊有噴球空氣槍＆大型噴球座，蠻類似小型騎士堡的感覺！ ;;;接著是中間區，這邊屬於大型的體適能活動區塊，有大型的溜滑梯！ ;;光來回一直爬上爬下就可以消耗不少小孩的體力啦！ ;;前面有咖啡杯的轉盤 ;;;旋轉桿; ;;;右邊是較靜態適合小小孩的區塊！ ;;;翻轉滾筒 ;;牆上有四組不同的手操作型玩具 ;;;彈珠台 ;;迷宮 ;;音樂鐵琴 ;;可愛的翹翹板 ;;;裡面這一區是騎馬區 ;;有四款不同的騎乘動物！ ;;;不過小福氣最愛的還是開小汽車啦！！ ;;館內大概有3位左右大哥哥大姊姊在看著孩子，在這一區的這位大姊姊是我覺得最親切的服務人員！還會主動去陪小福氣嚕小汽車耶！！來親子館最重要的除了玩耍之外，服務人員的耐心和愛心真的很重要！這位服務人員我大大的給她一個讚啊！！！ ;;館內有男廁女廁各一間，若是需要哺乳育嬰室則是要到百貨商場內的育嬰室！廁所門口也有擺放脫鞋提供使用！ ;;女廁的部分有多了尿布台 --;可能剛開幕的關係，今天來有發現一些小缺點：洗手台這邊都沒有另外放置擦手紙，很容易洗完手濕濕答答就滴得滿地！女廁的門不是很好關，需要往上抬起一點才能鎖上！廁所也應該要請服務人員定時進來清潔整理，確認衛生紙是否足夠！ ;;廁所的衛生紙用光沒人發現，我還特別去請服務人員再來補！ ;;;但是有一點蠻貼心的！男女廁這邊都有準備吹風機，小福星不小心尿褲子，洗完褲子馬上就有吹風機可以吹乾！或是小孩玩到滿身汗，這邊有吹風機就可以稍微把頭髮吹乾或是把衣服吹乾唷！ ;;猴子攝影師，這邊只要站在腳印處，相機就會有閃光，感覺就像在幫小朋友拍照一樣！小福星＆小福氣還一直擺Pose要拍照哩！太可愛了～～ ;;最後是彈跳床區＆溜滑梯 ;;;彈跳床小孩都會High翻天耶！！;--;玩耍時，建議大人都要在旁邊看著，避免發生意外唷！ ;;;加入會員就有20枚代幣，我們就讓小福星＆小福氣玩了幾個遊戲機台！這個小籃球機真的太可愛了！！ ;;旋轉拉拉熊  ;;小丸子校車 --;小福氣開車還真有架勢！！ ;;;眠羊星樂園不分平日假日一律都是一票到底！也就是說最便宜團票250元可以一早就進來玩到天黑才離開！真的是CP值超高！！！;肚子餓還可以先外出吃飯後再繼續回來玩呢！是給孩子瘋狂玩耍消耗精力的好所在啊！！推薦給大家囉！！ ;眠羊星樂園FB粉絲頁：&rarr;請點我&larr;;昕境廣場怎麼去呢？交通方式（開車、大眾交通工具）：;http://shine-square.vj007.net/about.aspx?id=traffic_info;;;（記得來Maggie愛分享粉絲頁按讚，就不會錯過各種好康資訊囉！）Maggie愛分享一併推廣你的粉絲專頁;更多親子遊戲空間分享：http://maggielin104.pixnet.net/blog/category/list/2891258;;;;;
【親子】台北。松山區－京華城騎士堡（小美人魚的家）。雨天溜小孩的好去處！,親子育兒,10832,0,50,http://aabbaabb88.pixnet.net/blog/post/191292921,;地址：台北市松山區八德路四段１３８號７F (京華城購物中心內)電話：02-3762-2236項目：球池、滑梯、轉轉樂、水族箱、幼兒專區...等等價位：（以現場公告為主）兒童全日套票;總值會員價（繳交100元工本費即可申辦）買四送一２４００元;１９２０元（平均３８４元）買八送四５７６０元３８４０元（平均３２０元）歡樂套組(30張)１４４００元９００元（平均３００元）單次卷;原價會員價家長卷;２００元１００元單次親子卷優惠價５９９元（含一大一小限每日12點前發售使用）營業時間：週日至週四 Am 10:00 ~ Pm 19:50 (最後入堡時間)週五、週六與例假日前 Am 10:00 ~ Pm 20:50 (最後入堡時間)商家網址：騎士堡。官方網站無線網路：無鄰近捷運站：1.搭乘板南線，至「台北車站」轉公車276、205、6052.搭乘板南線，至「市政府站」轉公車藍26、藍103.搭乘板南線，至「國父紀念館站」5號出口，轉公車266、254、2044.搭乘內湖線，至「劍南站」轉公車藍26附註：1.京華城購物中心憑當日騎士堡票根，可享免費停車2小時。（不包含團購券及免費體驗券）2.大人與小孩皆需著襪。;;&uarr;「入口」;這篇照片是今年四月帶兩隻小屁孩去【京華城騎士堡】所拍攝的不過最近外頭冷颼颼又開始下起綿綿細雨，這種天氣讓我又想起了這個好地方除了陪孩子在家玩耍兼搞破壞之外，這時最適合帶去室內兒童樂園啦！！帶著兩個孩子出去玩耍，最適合的就是把車直接開到室內停車場慢慢移動下車造訪過的內湖騎士堡 (恐龍探索樂園)與學學文創1＋1來玩都是符合我想躲開壞天氣的好去處哩！話說～騎士堡從高雄到台北共有八個營業據點，每個堡的主題都不一樣台北除了內湖騎士堡 (恐龍探索樂園)之外，在京華城還有另一個以【小美人魚的家】為主題這天我們就決定到京華城騎士堡玩耍兼消耗兩隻屁孩精力方便直接回家躺平囉！;;;&uarr;「娃娃車停放處」入口放置娃娃車的地方也是海底世界呢！;;;;&uarr;「購票處」之前在內湖騎士堡 (恐龍探索樂園)購買的是以小時計價的套票組不過在【京華城騎士堡】這裡又要另外購買惹（默默掏錢）雖然兒童全日套票購買張數越多越便宜，但我還是只買了最基本款的一來怕票卷太多用不完、二來怕遺失票卷我就糗大了......;;;&uarr;「入堡人數」進入樂園前，上方看版有入堡人數的顯示。;;;;&uarr;「小騎士劇院」這兒還有小騎士劇院呢！牆上還有放映時間表與名稱原以為當天可看電影，詢問後才知道當天只是開放給家長休息而已。;;;&uarr;「小騎士劇院」雖然沒有表演或電影可看，但還是進去參觀一下哩！;&uarr;「京華城騎士堡」遊樂園區外頭有監視器可看場內動態。;;;;&uarr;「出入口」;【京華城騎士堡】有好幾個出入口，當天唯一開放的出口是一號。;;&uarr;「鞋櫃」進入兒童樂園之前，別忘了先脫鞋與著襪噢！（大人小孩皆要）從一號出入口進來有一塊休息區，角落則有三、四個大鞋櫃可放鞋子鞋櫃上方的空間則可放置水壺，不過通常我還是會把孩子的水收在包包內。;;;&uarr;「櫃子」另外也有可上鎖的櫃子，有使用需要可以洽詢櫃檯人員。;;&uarr;「美人魚故事屋」靠近入口有幾個故事屋，有活動時會廣播可參加（持全日票才可以）。;;;&uarr;「指標」園區內有指標可以參考方向。;;;&uarr;「七彩氣球屋」小小氣球屋挺適合幼兒，但若是有大小孩在裡面就要注意安全囉！;;;&uarr;「海洋奇幻球池」首先來到【海洋奇幻球池】，這個球池真的超～～～大的！！一開始我家老大還有點害怕，不過隨後整個就是玩瘋啦！！裡頭最醒目的就是【章魚滑梯】，可從一旁軟墊斜坡攀爬上去而最大的藍色溜滑梯有工作人員會提醒孩子遊戲的安全。;;;&uarr;「波浪滑梯、金字塔攀岩」若【章魚滑梯】孩子不敢玩，也可以玩一旁比較小的波浪滑梯噢！;;;&uarr;「海洋奇幻球池」這裡當然也有爬上爬下的遊樂器材，可以鑽來鑽去，孩子開心極了！;;;;&uarr;「海洋奇幻球池」孩子最愛色彩繽紛的球池，不過在裡頭行走實在好累啊！;;;;;;;;&uarr;「海洋奇幻隧道」窄窄小小充滿奇幻的繽紛色彩，如果我是孩子一定也玩瘋啦！;;;&uarr;「海盜船冒險區」【海洋奇幻球池】旁是【海盜船冒險區】，上方還有章魚觸手管道連通兩區呢！;;;;&uarr;「海盜船冒險區」誰說鯨魚只會噴水呢？ 這隻鯨魚噴的可是球呢！;;;&uarr;「空氣槍」進到【海盜船冒險區】一旁牆上有數量眾多可射出軟球的空氣槍在裡頭行走可要小心頑皮的小屁孩們的軟球攻擊啦！咻咻咻～！！;;;;&uarr;「積木區」除了可在桌上玩積木之外，牆上還有整面的樂高牆可玩呢！;;;&uarr;「章魚轉轉樂」【章魚轉轉樂】有兩台，一台坐騎比較大、另一台坐騎比較適合小小孩當天我大兒子最喜歡坐這個設施，來回排隊了玩了好幾次呢！;;;;&uarr;「置物櫃」【章魚轉轉樂】旁有一個置物櫃。;;;;&uarr;「吹風機」場內也設有吹風機，方便孩子玩得滿頭大汗時吹乾。;;;;;;&uarr;「幼兒區」幼兒區裡頭有布書、益智遊具與大積木...等等另外還有一區【幼兒健身園地】我沒拍到。;;;&uarr;「幼兒球池」幼兒區這兒也有小小孩專屬的球池呦！;; ;&uarr;「出入口」;使用全日券當日可無限次數進出，出場前別忘了蓋章噢！;;;;;&uarr;「海洋生態水族箱」;前往【騎士廚房】的路上會看到兩個大水族箱，一旁還有動畫圖解呢！;;;&uarr;「拍照區」在洗手間與【騎士廚房】旁有一個讓孩子拍照的地點。;後記：【京華城騎士堡】真的很適合下雨天帶孩子來消耗體力吶！中場休息吃頓飯，再帶孩子來玩耍囉！不過【京華城騎士堡】旁的【騎士廚房】餐點不太美味（下一篇分享）...地下街美食也不太行...建議可以到京華城對面的BAC chocolate world。全台唯一巧克力主題餐廳吃頓美味的餐點呦！;圖／文：Ｂｉｂｉ／Ｍａｎａ【延伸閱讀】「食記」台北。松山區－BAC chocolate world。全台唯一巧克力主題餐廳;【親子】台北。松山區－Baby Play寶悅二館(Pause &amp; Bite商場內B1)。適合小小孩玩耍的室內遊戲區;【親子】台北。內湖區－Fun Kid Fun樂童樂。大直新開的室內親子遊樂園;【親子】台北。內湖區－騎士堡 (大潤發二館。恐龍探索樂園);【親子】台北。內湖區－1＋1來玩（學學文創三樓）。遊戲空間調整後再訪！;更多北部室內溜小孩的好地方更多北部戶外溜小孩的好地方更多台北親子餐廳、家庭式餐廳分享：）
【東京迪士尼之親子行】路過表參道&彩虹大橋,親子育兒,265,2,5,http://kyn.pixnet.net/blog/post/32513969,;離開明治神宮,接駁導遊路過表參道,讓我們下來感受一下這裡的FU這是那裡呢? 天使最有印象就是台灣明星最愛來這裡血拚的地方果然一下來.看到路人穿著打扮有一點點不一樣哦然後沿路看過去的商店,全是名牌精品.難怪.這裡會變成血拚聖地;;;對小朋友們來說,這裡反而成了最Boring的地方走沒幾步就裝了一副沒力.小可愛帶頭,QQ應合,一直喊沒力.走不動阿貴比較厲害,一路都黏在他爸身上.所以,我們只走了幾分鐘,就上車啦.哇哈哈.是說,這道大道還不錯,二邊的樹蔭大道,沿路的精品店,如果我是貴婦,我就天天來這敗家.可惜.天使只是一個"跪婦".(=跪在地上打掃的婦人).......~希望沒有冷到各位XDDD;;;;;;;;;回家路上,我們看到很圓很圓的月亮還有,那很有名的彩虹大橋.想起十幾年的東京愛情故事造就這座橋吧.真的是一個建築美的橋...........;;;;;;;;;;;這是在日本東京待的最後一晚,坐在車上看著美麗夕陽風景還是會有一種捨不得的FU.這大概是每次旅遊後一定要有症候群.哈哈哈.但這不是最後一篇...接下來還有哩^^; ;
【木柵 親子館】文山親子館／台北市文山托育中心　2013/7/30開幕,親子育兒,12015,2,104,http://star3669.pixnet.net/blog/post/167724287-%e3%80%90%e6%9c%a8%e6%9f%b5-%e8%a6%aa%e5%ad%90%e9%a4%a8%e3%80%91%e6%96%87%e5%b1%b1%e8%a6%aa%e5%ad%90%e9%a4%a8%ef%bc%8f%e5%8f%b0%e5%8c%97%e5%b8%82%e6%96%87%e5%b1%b1%e6%89%98,用"媽媽的角度"看世界後，發現很多的不一樣;今天來到位於木柵的文山親子館這是台北市第二家採複合式建置的親子托嬰館在全聯的右邊樓梯上去是文山親子館;兩邊的走道旁上方也有巧思造景;因剛開幕，所以門口一堆花籃，真喜氣 ;;為了控管使用品質，每場次限制50對親子使用(35對網路或電話預約，15對現場排隊);櫃檯服務員電話接不完，因聽說第一天網路整個爆滿進不了;一入館內左手邊就有洗手檯，請先幫孩子換好鞋子後，洗完手在入館內玩，請愛自己也愛別人;正前方是一排鞋櫃鞋櫃上方小朋友休息時可以坐在上面吃點東西右邊則是擺放包包的置物櫃;櫃子旁邊有賣襪子的機器，忘記穿襪子又突然想來排現場的媽媽們可以來這買喔!望眼一看，只能說 ; 超級大間 ; ;我的相機用全景也真沒辦法拍完全部的空間呢！;;館內規劃則是分別為:感覺統合區、手創區、建構區、舞台扮演區、大型體能活動區、繪本區、展示區及多功能教室。;;舞台扮演區格子內其實應該有很多角色扮演的衣服，但是我們太晚到，一件都不剩了旁邊也有手偶布娃娃，可以用來講故事，使得故事更生動活潑喔 大型體能活動區;;繪本區 有不少很有名的童書繪本，真是造福不喜歡買書的媽媽福音阿;;手創區 ;使用無毒的果漾彩繪筆小朋友使用真安心還有很多環保教材可以讓小朋友自己動手剪剪貼貼，既環保又安全感覺統合區;;;有像這樣可以扶的又有鏡子的教材，讓學走的寶寶的媽咪好安心 ;;磁鐵玩具多功能教室;附洗手台，記得讓玩完玩具的小朋友養成洗手的好習慣喔教材都放在櫃子裡，櫃外面直接有圖可以看到，挺方便的;;建構區;屬於積木及辦家家酒類;;哺乳室;哺乳室內的飲水機才有溫水喔!;; ;在廁所旁邊的這台，因為怕小孩子觸摸到，所以只提供冷水 ;;;;;;;尿布檯在廁所(男女皆有)動物遊樂園有超多好玩的小玩具跟布娃娃;;;這個地板很特別，分別貼上不同觸感的物體來刺激寶寶腳穴   ;用紙箱做的熊與鱷魚 ; ;;;大型的多功能玩具轉轉樂;用紙箱做的巧虎黏球組; 幾個有趣小玩具 ;; ;;;;;中間還有像這樣的休息區 ;;;;;;; ;; ;;;;;;;;;;;;;;;;;;; ;;;;而從全聯外面有電梯做到二樓是台北市第五家的文山區公辦民營托嬰中心昨天開幕;參觀後採隔間式的分齡收托，分別為娃娃班(2m-7m)最多10人、寶寶班(8m-14m)最多15人、幼幼班(15m-2y)最多15人分所以整間托嬰中心只有40個小朋友，老師比例是1:5然後針對不同年齡層嬰幼兒的需求及刺激，設置所需要的設施，大小孩不會互相干擾。 ;;一入內就有老師在講解報名抽籤的內容 ;開幕那天半的抓周活動;還有一堆車車!! 宇揚的最愛;os:怎麼不是在親子館內....;   ;;;;   ;;       ;;;; ; ; ;;;番外篇:宇揚在親子館內，推了這白色的櫃子 ;然後當下有哭，但是我不以為意，後來來參觀托嬰中心時，才發現流血當下老師直接請我進去保健室幫宇揚擦藥，真是揪感心耶~;大推阿; ; ; ;;;文山親子館★地址: 臺北市文山區木柵路1段177號2樓★電話: 02-2236-5186★時段: 週二至週五9:30~12:00、14:00~17:00週六及週日9:30~11:00、13:00~14:30、15:30~17:00★貼心小提醒: 每場限50對親子使用，其中35對網路或電話預約，15對現場排隊~★網址:;https://taipei.parent-child.org.tw/index.php?md=index&amp;cl=index&amp;at=index&amp;pfid=12;;文山托嬰中心服務對象為設籍臺北市滿2足月至未滿2足歲嬰幼兒，收托人數40名。收費每月11,000元。收托時間為週一至週五上午7時30分至下午6時30分，得視需要提供延托或臨托服務。7月30日至8月9日開放參觀，並同步受理報名登記；8月1日及8月4日召開招生說明會。8月10日9時公開抽籤，同日下午3時於文山托嬰中心及社會局網站公告結果，預定8月19日起正式收托。相關訊息請洽該中心2236-1388。;;延伸閱讀相關親子資訊舊文連結:【全台 親子館 】彙整各地親子館資訊 (2013/7/31更新);【基隆 親子館】基隆市安樂托育資源中心(基隆婦幼中心3樓);【大安 親子館】BabyPlay寶悅親子樂園;【西門町 親子館】又又星樂園;【松山 親子館】童心園 weplay親子館 體驗趣;;
[遊記]基隆海科館 八斗子Artr彩繪親子餐廳,親子育兒,19409,1,30,http://rengshiun.pixnet.net/blog/post/251758060,; ;;; 前兩周因為嫩芽爸出差南部的關係, 所以我們全家跟著他在南部待了快兩周, 好不容易工作事情解決才回到台北,想說很久沒跟朋友約出去聚聚了,於是趁著周末假日上網看看有沒有不錯的地方可以聚聚, 現在有了小孩, ;凡事都要考慮到小孩,跟朋友聚會的餐廳, 也是以親子餐廳當首選了,很幸運找到了一間在基隆海科館,才在試營運的八斗子Artr彩繪親子餐廳,他是採預約制,馬上打電話去預約,雖然是去的前一天才打 ,但可能是試營運期間還沒有很多人知道,所以很幸運的一下就訂到了位置!;;;;; 到了海科館, 找了一下位置,原來Artr是在海科館右方的探索區域館4F,不是真的在海科館本館內,一坐電梯上四樓就到了,童趣的佈置一眼就知道是間親子餐廳Artr入口處在外面看還真不知道,裡面的空間真的是超大的,也分好幾個遊戲區,由服務人員帶領先找到我們的座位, 空間真的超級大,非常的舒服色彩繽紛的開水壺,很有特色,也成為餐廳裡佈置的一部分,讓人眼睛一亮跟服務人員點完餐趁餐還沒上連媽媽我自己都已經迫不及待想把餐廳繞一圈看看遊戲空間有好幾區,從這一區旁邊沙發上方的窗戶,看出去就是港口,可以看八斗子漁港呢由窗戶看出去的景色,天氣好時我想景色一定更美繞餐廳一圈後,餐點已陸陸續續上了,於是我們就先回到了座位上我們有點套餐,套餐是一份主餐+120元,有一份前菜沙拉,及磨菇濃湯或附餐飲料任選嫩芽爸的義大利獵人雞肉燉飯小人套餐, 我們點的是番茄肉丸通心麵,也有一份蘑菇濃湯, 套餐內除了有水果還附有一根棒棒糖及一包Kid-O餅乾,設計的真的很得小人的心,嫩嫩一看到棒棒糖就超級興奮的瞧嫩吃到棒棒糖開心的模樣媽媽我的椒鹽松阪豬燉飯,在這邊小小抱怨一下,這松阪豬我吃到最後兩三塊時,發現豬肉煎得不是很熟,肉是呈現粉色的,咬就知道根本沒熟也咬不下去,跟服務人員反應,去幫我問了廚房,回答說松阪豬本來就要吃九分熟, 不能太熟就不好吃了, 這我當然知道啊, 以為我沒在下廚嗎?;問題是肉沒熟根本咬不下去,是要我硬吞嗎?廚師你自己火候沒有拿捏好沒煎好就承認嘛我只是希望你弄熟後我可以繼續吃, 這樣浪費了我三塊松阪豬, 反應了問題後這種說法,其實沒辦法讓人信服也不是很滿意,;但除了這點外,對於小人的空間設施部分,我是還算滿意這一區除了軌道車,可看港口景色, ;另外有放置大型積木,還有軟性玩具,很多布玩偶及書,這一區還蠻適合小小孩的!;光看這一區就覺得空間已經很大了吧, 但這只是其中一區而已, 再來看看別區這個空間的另外一面就是玻璃彩繪牆,彩繪筆放在旁邊桌子上, 可以任意取用,一大面的玻璃, 可以讓小人任意畫畫這一區是玩沙區,在親子餐廳中,很少會附設玩沙區, 通常在親子樂園會比較常看到,畢竟這要清理也蠻費工的, 所以Artr有附設玩沙區真的蠻特別的,而且令人非常意外的,他的沙真的超級乾淨的,芽芽一個人可以在那邊玩快一個小時不起來,我過去抱起他時,輕輕拍拍衣服上的沙就全都掉下來了 , 手上也沒有黏到沙那種不舒服的感覺,真的很意外,後來聽跟工作人員說才知道,別看這小小一池沙,也要要價上萬塊呢!光是這個玩沙區,可以耗掉小人不少時間,都可以自己乖乖的坐在裡面玩再來看這一區,裡面附設的都是廚房玩具,這一區設計得也很有海港元素這一區裡面附的廚房道具,很多都是用紙箱做成的道具,有種廢物利用的教育意義,還蠻特別的雖然沒有像Mother Garden廚房玩具這麼精緻可愛 ,但小人們感覺也是玩得很開心,是啊!其實小孩們哪懂這玩具質感好不好,貴不貴,其實這個概念蠻好的,用不要的廢棄紙箱做成的玩具還不是一樣玩得很開心呢!;再來到另外一區,這區感覺就是基本款了, 有Rody跳跳馬, 溜滑梯等等...也可耗掉小人不少精力再來就是靠近入口處有一區專門規劃給小孩塗鴉彩繪的地方, 如果怕弄髒衣服,現場也有提供圍兜給小朋友們穿,就不怕弄髒衣服了小朋友都畫得很開心,不過嫩芽好像對這區並不特別感興趣,;沒有跟我們說要去玩,所以也就沒過去畫了;最後附上一張芽芽搞笑照,最近叫他嘴巴張開,芽妹她就會把嘴巴張得超級誇張的大,臉都皺成一團好像深怕別人看不清楚的感覺, 超爆笑的!!整體而言,Artr的CP值還算不錯, 如果不是來用餐,只是來喝喝咖啡聊聊天,我覺得也不錯,現在嫩芽她們已經慢慢可以自己玩,有時自己玩自己的,或有時兩個玩在一起,;大人們只要在旁邊稍微看一下陪著就好了,已經有越來越輕鬆的感覺了, 所以帶著小人點杯飲料跟三五好友來這邊聚聚聊天還算是輕鬆不錯的好選擇!;海科館Artr彩繪親子餐廳好像還沒自己的網頁,有興趣可以上FB參考一下https://www.facebook.com/artrwatercolor或海科館的官方網址:http://www.nmmst.gov.tw/chhtml/index.aspx地址:基隆市中正區北寧路367號 （區域探索館4樓)訂位專線:02-24693496;推薦給大家!;;
親子體適能遊戲 ,親子育兒,436,0,0,http://ailsa0221.pixnet.net/blog/post/70122533,;慶祝父親節免費親子體適能遊戲由新苗體能工作室的可愛活潑的西瓜老師來和大家一起過一個好玩有趣的父親節;親愛的爸爸們為自己和孩子留下一個難忘的甜美回憶吧！活動內容： 親子體能律動、幼兒體能運動、親子體適能遊戲活動時間：100年8月6日 星期六 早上10點活動地點：台北市龍江路397巷12號1樓報名電話： 25097435;聯絡EMail;:;lojakid@yahoo.com.tw名額有限;; 請儘速報名;; 以免向偶
